{
  "slug": "48-hours-snowdonia",
  "title": "48 Hours in Snowdonia: What to Actually Do",
  "excerpt": "Snowdonia in 48 hours? Forget ticking boxes. This is about getting *stuck in*, experiencing the best bits, and leaving wanting more.",
  "category": "guide",
  "content": "Snowdonia in 48 hours? Forget ticking boxes. This is about getting *stuck in*, experiencing the best bits, and leaving wanting more.\n\n# 48 Hours in Snowdonia: What to Actually Do\n\nSo, you've got two days in Snowdonia. Good choice, butt. But ditch the tourist traps and generic \"top 10\" lists. This is about making the most of it, Welsh-style. I’m assuming you're reasonably fit, up for a bit of a challenge, and not afraid of a bit of rain (it’s Wales, after all).\n\n## Day 1: Summit Views and Forest Thrills\n\n### Morning: Conquer Snowdon (the sensible way)\n\nLet's be honest, if you're coming to Snowdonia, you're probably thinking about climbing Snowdon (Yr Wyddfa). Now, you *could* tackle Crib Goch – guided trips with MountainXperience will set you back £55-75 – but unless you're an experienced scrambler and the weather's playing ball, I’d advise against it. It’s not a pleasant experience in the wet, and frankly, it’s for the adrenaline junkies.\n\nInstead, consider the Llanberis Path. It's the longest and gentlest route, but still a decent slog. Allow 6-7 hours for the round trip. A guided walk with MountainXperience will cost £45-65, which is money well-spent if you're unsure of navigation or want some local knowledge. Alternatively, Snowdonia Mountain Guides offer similar walks for £60-80. Parking in Llanberis itself can be a nightmare, especially in peak season (summer and weekends). Get there early (before 8am) or use the park-and-ride from Nant Peris (£5 for the day).\n\n**Who should skip this:** If you have mobility issues or are genuinely afraid of heights, consider the Snowdon Mountain Railway instead (booking essential, prices vary depending on the season, but expect to pay £35-£45 return).\n\n**Terrain:** Mountain\n**Difficulty:** Moderate\n**Tags:** hiking, mountain, moderate, guided, booking-required\n\n### Afternoon: Zip Through the Trees (or Bounce Underground)\n\nAfter descending Snowdon, you’ll be buzzing. Keep that adrenaline flowing. Head to Zip World near Betws-y-Coed. They have a few locations around North Wales, but this one is central.\n\nYou have a few choices here.\n\n*   **Zip World Fforest Coaster:** A toboggan run through the forest. Surprisingly good fun, and suitable for families. Expect to pay £25-35.\n*   **Bounce Below:** Trampolines in a massive underground slate mine. Unique and surprisingly tiring! Also around £25-35.\n*   **Velocity 2:** If you haven't had enough of heights, this is the one for you. The fastest zip line in the world, apparently. It's pricey, at £89-109, but worth it for the bragging rights.\n\nI’d personally go for the Fforest Coaster if you want something for everyone, or Bounce Below for a unique experience. Velocity 2 is for the proper thrill-seekers.\n\n**Who should skip this:** Anyone with back problems should avoid the Fforest Coaster. Claustrophobes, give Bounce Below a miss.\n\n**Terrain:** Forest, Underground\n**Difficulty:** Family, Moderate\n**Tags:** zip-lining, family-friendly, booking-required\n\n### Evening: Relax and Refuel in Betws-y-Coed\n\nHead back to Betws-y-Coed. It's a bit touristy, but it's got a good selection of pubs and cafes for a well-deserved pint and some grub. Parking can be tricky in the evening, so arrive early or be prepared to walk a bit.\n\n## Day 2: Mountain Biking and Waterfall Wonders\n\n### Morning: Hit the Trails at Coed y Brenin\n\nCoed y Brenin Forest Park is a mountain biking mecca. Whether you’re a seasoned pro or a complete beginner, there’s a trail for you. Parking costs £2-7 for the day, depending on how long you stay.\n\n*   **MinorTaur:** A good option for families and beginners. It's a mostly flat loop with some gentle climbs.\n*   **Temtiwr:** If you're after something more challenging, this is a good step up. Expect some technical sections and steeper climbs.\n\nIf you’re serious about your mountain biking, Antur Stiniog, near Blaenau Ffestiniog, offers uplift access to some seriously gnarly downhill trails (£35-45 for uplift). It's not for the faint of heart.\n\n**Who should skip this:** If you absolutely hate cycling, maybe stick to the walking trails around Coed y Brenin.\n\n**Terrain:** Forest, Woodland\n**Difficulty:** Family-Friendly, Moderate, Challenging\n**Tags:** mountain-biking, family-friendly, free-parking\n\n### Afternoon: Waterfall Chase and Scenic Drives\n\nAfter your morning of biking, it’s time for a change of pace. Snowdonia is full of stunning waterfalls.\n\n*   **Swallow Falls:** A classic, easily accessible waterfall near Betws-y-Coed. There's a small entrance fee (£2.00).\n*   **Rhaeadr Ewynnol (Conwy Falls):** Another beautiful waterfall, slightly less crowded than Swallow Falls. There's a cafe and visitor centre on site.\n\nAfter your waterfall fix, take a scenic drive through the Ogwen Valley. The A5 from Capel Curig to Bethesda is one of the most stunning roads in Wales, with dramatic mountain views. Stop at Llyn Ogwen for a photo opportunity.\n\n**Who should skip this:** If you're tight on time, pick one waterfall and focus on the Ogwen Valley drive.\n\n**Terrain:** Valley\n**Difficulty:** Easy\n**Tags:** easy, year-round\n\n## Alternative Adventures\n\nIf mountain biking isn't your thing, or the weather's truly atrocious, here are a few other options:\n\n*   **Explore the Llyn Peninsula:** Head west and discover hidden beaches, coastal walks, and charming villages like Aberdaron.\n*   **Go underground:** Zip World Llechwedd offers mine exploration experiences suitable for families. Prices range from £20-35.\n*   **Try Gorge Walking:** Adventure Britain runs gorge walking trips in Snowdonia. Prices from £65-95.\n\n## Important Considerations\n\n*   **Weather:** Snowdonia weather is notoriously unpredictable. Be prepared for rain, wind, and even snow, even in summer. Pack waterproofs, layers, and sturdy boots.\n*   **Parking:** Parking can be a major issue, especially in popular areas. Arrive early, use park-and-ride services, or be prepared to walk.\n*   **Booking:** Book activities in advance, especially during peak season.\n*   **Safety:** Be aware of your surroundings, follow marked trails, and let someone know your plans.\n\nSo there you have it. 48 hours in Snowdonia, done properly. It's not a gentle stroll, but a proper taste of what this amazing part of Wales has to offer. Now get out there and explore!",
  "heroImage": null,
  "author": "Adventure Wales",
  "regionSlug": "snowdonia",
  "activityTypeSlug": null,
  "tags": [
    "hiking",
    "mountain",
    "moderate"
  ],
  "readTimeMinutes": 4
}