{
  "slug": "best-adventures-near-manchester",
  "title": "Best Welsh Adventures from Manchester & Liverpool",
  "excerpt": "For those escaping Manchester or Liverpool, Snowdonia offers accessible adventure. This guide covers top thrills and practical advice for making the most of your trip.",
  "category": "guide",
  "content": "For those escaping Manchester or Liverpool, Snowdonia offers accessible adventure. This guide covers top thrills and practical advice for making the most of your trip.\n\n# Best Welsh Adventures from Manchester & Liverpool\n\nSnowdonia. Just the name conjures images of jagged peaks, rushing rivers, and that proper Welsh drizzle. Luckily, it's a fairly straightforward shot down the A55 from Manchester and Liverpool, making it ideal for a weekend blitz of adventure. Expect a drive of around 2-3 hours, depending on which part of the park you’re aiming for and how heavy your right foot is.\n\n## Thrills Above (and Below) Ground\n\nLet's face it, most people are drawn to Snowdonia for the mountain landscapes, but there's plenty to do beyond just walking. Here are a few adrenaline-pumping options:\n\n*   **Velocity 2 Zip Line (Zip World Penrhyn Quarry):** Right, let's get the big one out of the way. This is Europe’s fastest zip line, and it's not for the faint of heart. You're strapped in horizontally and launched over a flooded quarry. It’s utterly bonkers and brilliant. Expect to pay around £89-£109 for the experience. Booking is essential, and do it well in advance, especially during peak season. Consider a multi-activity day at Zip World, maybe combine it with the Quarry Karts.\n\n*   **Bounce Below (Zip World Llechwedd):** Prefer your thrills underground? Bounce Below is a series of giant trampolines strung across caverns deep within a slate mine. It's a fun, slightly surreal experience. Prices are around £25-£35. Good for families with slightly older kids who won't get overwhelmed by the dark.\n\n*   **Antur Stiniog Downhill Mountain Biking:** If two wheels are more your thing, head to Antur Stiniog near Blaenau Ffestiniog. They offer uplift services (essential, unless you fancy pushing your bike uphill all day) to a network of downhill trails catering to all skill levels. Expect to pay £35-£45 for the uplift. It's a proper adrenaline rush, but definitely not for beginners. Coed y Brenin Forest Park offers a wider range of mountain biking trails, including the family-friendly MinorTaur trail or the challenging Temtiwr, with parking costing £2-7.\n\n## Scaling Snowdon (and Beyond)\n\nOf course, no trip to Snowdonia is complete without tackling Yr Wyddfa (Snowdon). But which route to choose?\n\n*   **Llanberis Path:** This is the most popular and easiest route to the summit. It's a long slog, but the gradient is relatively gentle. Snowdonia Mountain Guides and MountainXperience both offer guided walks up this route, costing around £45-£80. If you're a confident hiker and the weather is good, you can tackle it solo. Parking in Llanberis is a nightmare, especially in summer. Get there early (before 8 am) or consider using the Sherpa bus service from nearby park and ride locations.\n\n*   **Crib Goch:** Now, this is a different beast altogether. Crib Goch is a knife-edge arete, and it's not for the faint of heart. This is proper scrambling, with serious exposure. One slip and you're in serious trouble. Only attempt this if you're an experienced scrambler with a head for heights. MountainXperience offer guided ascents for £55-£75, which is a sensible option if you're not confident.\n\n*   **Other Snowdon Routes:** The Pyg Track, Miners' Track, and Watkin Path all offer different challenges and perspectives. Research them carefully before you go and choose one that suits your fitness level and experience. Remember to check the weather forecast before you set off, as conditions on Snowdon can change rapidly.\n\n## Beyond the Summit: Other Activities\n\nSnowdonia offers more than just hiking and adrenaline activities.\n\n*   **Plas y Brenin:** The National Mountain Sports Centre offers a range of courses, from rock climbing taster sessions (£150-£300) to sea kayaking adventures (£150-£400). It's a great place to learn new skills or improve existing ones.\n\n*   **National White Water Centre:** Located near Bala, this is the place to go for white water rafting. Expect to pay around £55-£75 for a session. It's a fun, wet, and wild experience.\n\n*   **Gorge Walking with Adventure Britain:** Explore Snowdonia's stunning gorges with a guided gorge walking experience. Scramble up waterfalls, plunge into pools, and have a proper good time. It'll cost you £65-£95.\n\n## Practical Considerations\n\n*   **Accommodation:** Book well in advance, especially if you're visiting during peak season (summer and school holidays). Betws-y-Coed, Llanberis, and Beddgelert are all good bases.\n*   **Parking:** As mentioned, parking can be a nightmare, especially in popular areas. Use park and ride services where available and arrive early.\n*   **Weather:** Snowdonia is notorious for its unpredictable weather. Be prepared for all conditions, even in summer. Pack waterproofs, warm layers, and sturdy footwear.\n*   **Gear:** For hiking, you'll need proper walking boots, waterproofs, a map, compass (or GPS), and plenty of food and water. For other activities, check with the operator what gear is provided.\n*   **Cost:** Snowdonia can be an expensive place to visit, especially if you're doing lots of activities. Factor in accommodation, travel, food, and activity costs.\n\n## Alternatives Further South\n\nFancy a change of scenery? Consider these alternative adventures:\n\n*   **Brecon Beacons National Park:** For excellent hiking and stunning scenery that's less crowded than Snowdonia. The Pen y Fan horseshoe is a classic hike.\n*   **Pembrokeshire Coast Path:** For coastal hiking and coasteering. Check out MUUK Adventures for guided coasteering sessions.\n\nSnowdonia is a cracking place for an adventure, easily accessible from the North West. Do your research, be prepared for the weather, and get ready for some proper Welsh thrills. You won't regret it.",
  "heroImage": null,
  "author": "Adventure Wales",
  "regionSlug": "snowdonia",
  "activityTypeSlug": null,
  "tags": [
    "hiking",
    "zip-lining",
    "mountain"
  ],
  "readTimeMinutes": 4
}