{
  "slug": "rock-climbing-beginners-wales",
  "title": "Rock Climbing for Beginners in Wales",
  "excerpt": "Learning to climb in Wales is easier than you think. Here's a practical guide to getting started, with specific locations, prices, and honest advice.",
  "category": "guide",
  "content": "Learning to climb in Wales is easier than you think. Here's a practical guide to getting started, with specific locations, prices, and honest advice.\n\n# Rock Climbing for Beginners in Wales\n\nSo, you fancy clinging to some rock, eh? Good on you. Climbing's a proper buzz, but it's not all Lycra and superhuman strength. Anyone can give it a go, and Wales is chock-full of spots perfect for beginners. Forget what you see in those fancy climbing films – we’re talking about getting your hands chalky, learning the ropes (literally!), and maybe even topping out your first climb. This guide will give you the lowdown on getting started, Welsh-style.\n\n## Is Climbing For You?\n\nLet's be straight: climbing ain't for everyone. If heights make you feel like you’ve swallowed a brick, or you really can't stand the thought of a bit of physical exertion, then maybe stick to the coastal path. But if you’re up for a challenge, enjoy problem-solving, and don’t mind the occasional scrape, then read on. It's brilliant for building strength, coordination, and giving you a mental workout too. Plus, the views from the top can be pretty special.\n\n## Where to Start: Guided Sessions\n\nThe best way to dip your toes into the world of climbing is with a guided session. This gets you safely introduced to the basics by an experienced instructor who can show you the ropes (again, literally!), proper technique, and how to use the gear. Here's a few options across Wales:\n\n*   **Snowdonia:** Head to Plas y Brenin, the National Outdoor Centre. They offer \"Rock Climbing Taster\" sessions suitable for all levels. Expect to pay between £150-£300 for a day course. It's worth the investment to learn from some of the best instructors in the country. Parking at Plas y Brenin is ample but can get busy during peak season; expect to pay around £5 for the day.\n*   **Pembrokeshire:** TYF Adventure near St Davids offer climbing sessions from £60. They're a great bunch, and Pembrokeshire's coastal cliffs provide stunning scenery while you learn. While you're there, consider trying coasteering or sea kayaking with them, too – TYF are experts in making the most of the coast. Parking can be tricky in St Davids, especially in summer; aim to arrive early.\n*   **Brecon Beacons:** Adventure Britain, based near Brecon, runs climbing sessions in the national park for £65-£95. The Beacons offer a different climbing experience, with inland crags and a more rugged feel. You could combine it with a mountain biking trip at BikePark Wales (a short drive away).\n*   **Gower:** Rip N Rock provides climbing experiences on the Gower Peninsula from £55-£85. The Gower's limestone cliffs are perfect for beginners, and you'll be climbing with a view of some of Wales' finest beaches.\n\n**What to expect:** Guided sessions typically include all the necessary equipment (harness, helmet, shoes, ropes), instruction on basic climbing techniques, safety procedures, and a chance to climb several different routes.\n\n## Gear: What You Need (and What You Don't)\n\nAs a beginner, don’t even *think* about buying your own gear just yet. All reputable climbing operators will provide everything you need for your initial sessions. Once you're hooked (and trust me, you probably will be), then you can start considering investing in your own kit.\n\n*   **Climbing shoes:** These are the most important piece of personal gear. They're designed to give you maximum grip and precision on the rock. Expect to pay £80-£150 for a decent pair.\n*   **Harness:** Essential for safety. Look for a comfortable harness with adjustable leg loops. Prices range from £50-£100.\n*   **Helmet:** Non-negotiable. Protect your head. A basic helmet will set you back around £40-£70.\n*   **Chalk bag:** Keeps your hands dry and improves grip. £15-£30.\n*   **Belay device:** Used to control the rope and belay your climbing partner. Around £30-£60.\n\nRemember, buying cheap gear is a false economy. Your life depends on it. Stick to reputable brands and buy from experienced retailers.\n\n## Essential Climbing Techniques\n\nDon't worry about mastering every technique on day one. But understanding these basic principles will set you up for success:\n\n*   **Footwork:** This is crucial. Use your feet to push yourself up, not just your arms. Think about placing your feet precisely on holds.\n*   **Body position:** Keep your weight close to the wall and use your legs as much as possible. Avoid \"barn-dooring\" (swinging outwards from the wall).\n*   **Communication:** Clear communication with your belayer is vital. Use standard climbing commands (\"On belay?\", \"Climbing!\", \"Take!\", \"Safe!\").\n*   **Trust your gear:** It's designed to hold you. Don't be afraid to lean back and trust the rope.\n\n## Top Beginner Climbing Spots in Wales\n\nOnce you've got some experience under your belt, you might want to explore some of Wales' best beginner-friendly climbing spots. Here are a few suggestions:\n\n*   **Snowdonia:** Idwal Slabs are classic beginner climbs. They offer easy-angled slabs with plenty of holds. Be aware that Idwal Slabs are *very* popular, especially on weekends and during the summer. Parking at Ogwen Cottage (SH 661 602) fills up quickly; arrive early or use the Sherpa bus service. The walk to the base of the climbs is short but rocky.\n*   **Gower:** Three Cliffs Bay has several low-grade climbs suitable for beginners. The setting is stunning, but be aware of tides and loose rock. Parking is available in nearby villages (Horton or Southgate), with a walk to the beach.\n*   **Pembrokeshire:** As mentioned before, the coastal cliffs around St Davids offer great beginner climbing. Many routes are easily accessible and well-protected. Remember to check tide times, as some climbs are only accessible at low tide.\n*   **North Wales Coast:** The Great Orme near Llandudno has climbs for all levels, including some gentle routes suitable for beginners. Plus, you get a fantastic view of the sea. Parking is available at the summit of the Great Orme.\n\n**Important:** Always check the weather forecast before heading out climbing. Conditions in Wales can change rapidly, especially in the mountains. Be aware of tides if climbing on coastal cliffs. And always climb with a qualified belayer and use appropriate safety equipment.\n\n## Climbing Safety: Don't Be a Numpty\n\nClimbing is inherently risky, but by following these safety guidelines, you can minimize the risks:\n\n*   **Never climb alone:** Always climb with a qualified belayer.\n*   **Check your gear:** Before each climb, inspect your harness, helmet, rope, and belay device for any signs of wear or damage.\n*   **Communicate clearly:** Use standard climbing commands to communicate with your belayer.\n*   **Be aware of your surroundings:** Watch out for loose rock, changing weather conditions, and other climbers.\n*   **Know your limits:** Don't attempt climbs that are beyond your skill level.\n*   **Take a first aid course:** Knowing basic first aid is essential for any outdoor activity.\n\n## Beyond Climbing: Other Welsh Adventures\n\nClimbing is just the tip of the iceberg when it comes to outdoor adventures in Wales. Once you've got the climbing bug, why not try some of these other activities?\n\n*   **Mountain walking:** Wales is home to some of the best mountain walking in the UK. Tackle Snowdon via the Miners' Track (a moderate route) or explore the Brecon Beacons' highest peak, Pen y Fan.\n*   **Coasteering:** Scramble along the Pembrokeshire coast, jumping into the sea and exploring hidden coves.\n*   **Canyoning/Gorge Walking:** Explore rivers and waterfalls by swimming, scrambling, and abseiling. (See Adventure Britain in the Brecon Beacons).\n\n## Final Thoughts\n\nClimbing in Wales is an experience you won't forget. Whether you're a complete beginner or a seasoned climber, there's something here for everyone. So, get out there, get your hands chalky, and enjoy the view from the top. Just remember to respect the environment, climb safely, and have fun!",
  "heroImage": null,
  "author": "Adventure Wales",
  "regionSlug": null,
  "activityTypeSlug": "climbing",
  "tags": [
    "climbing",
    "beginner-friendly",
    "guided",
    "equipment-provided"
  ],
  "readTimeMinutes": 5
}