{
  "slug": "winter-hiking-gear-welsh-mountains",
  "title": "Winter Hiking Gear for Welsh Mountains",
  "excerpt": "Don't let the beautiful scenery fool you: a Welsh mountain in winter demands respect. Proper gear isn't optional; it's the difference between a cracking day out and a hypothermic nightmare.",
  "category": "gear",
  "content": "Don't let the beautiful scenery fool you: a Welsh mountain in winter demands respect. Proper gear isn't optional; it's the difference between a cracking day out and a hypothermic nightmare.\n\n# Winter Hiking Gear for Welsh Mountains\n\nAlright, listen up, because this isn't some fluffy list from someone who's never seen a proper Welsh winter. This is what you *actually* need if you're planning on tackling anything more serious than a stroll along the beach at Whitesands in January. We're talking Snowdon, Pen y Fan, Cadair Idris – the proper stuff. Forget looking stylish; focus on staying alive and (relatively) comfortable.\n\n## The Essentials: Clothing\n\nThis is where you spend the money. Don’t skimp. The layering system is key here, and it's got to be the right layers.\n\n*   **Base Layers:** Merino wool or synthetic. Forget cotton; it's useless once wet. I'm talking top and leggings. Expect to pay £40-£80 per item for decent merino. Brands like Icebreaker, Smartwool, and Rab are reliable. Synthetic options like Patagonia Capilene are cheaper (around £30-£60 per item) and dry faster, but can get a bit whiffy.\n*   **Mid-Layers:** Fleece or insulated jacket. A good fleece (like a Polartec Power Stretch) is versatile and dries quickly. Expect to pay £50-£100. For colder conditions, a lightweight down or synthetic insulated jacket (e.g., Patagonia Nano Puff, Rab Xenon) is invaluable. These range from £150-£300. Synthetic is better if you expect a lot of rain because down loses its insulation when wet.\n*   **Outer Layer (Shell):** Waterproof and breathable jacket and trousers. This is *crucial*. Look for a Gore-Tex or similar membrane (e.g., eVent). Don’t bother with cheap \"water-resistant\" options; they won’t cut it in a proper Welsh downpour. Expect to pay £200-£500 for a decent jacket and £150-£300 for trousers. Brands like Arc'teryx, Rab, and Montane are worth the investment.\n*   **Socks:** Wool or synthetic blend. Again, avoid cotton. Thick hiking socks are essential for warmth and cushioning. Expect to pay £15-£30 per pair. Carry a spare pair; wet socks equal misery.\n*   **Gloves:** Waterproof and insulated. Mittens are warmer than gloves, but less dexterous. Consider a liner glove underneath for extra warmth. Expect to pay £40-£80 for a decent pair.\n*   **Hat:** Wool or synthetic. Covers your ears. Simple as. Expect to pay £15-£30.\n*   **Balaclava/Buff:** Essential for protecting your face in wind and snow. Expect to pay £10-£30.\n\n## Footwear: Boots and Traction\n\nYour boots are your connection to the mountain. Get them right.\n\n*   **Boots:** Sturdy, waterproof hiking boots with ankle support. Full leather or synthetic/leather hybrids are fine. Make sure they’re properly broken in before you hit the hills. Expect to pay £150-£300. Brands like Salomon, Scarpa, and Meindl are popular choices. Go to a proper outdoor shop in somewhere like Llanberis and get fitted properly.\n*   **Traction Devices:** Microspikes or crampons. If there's any chance of ice or snow (and in winter, there almost always is), you *need* these. Microspikes (e.g., Kahtoola MICROspikes) are suitable for packed snow and ice. Crampons are necessary for steeper, icier terrain. Expect to pay £50-£150 depending on the type. Practice using them before you need them! A fall on Crib Goch without proper crampons is almost certainly fatal.\n*   **Gaiters:** Keep snow and mud out of your boots. Simple and effective. Expect to pay £20-£40.\n\n## Navigation and Safety\n\nGetting lost or injured in the Welsh mountains in winter is a serious situation.\n\n*   **Map and Compass:** Learn how to use them. GPS devices are great, but batteries die, and technology fails. An Ordnance Survey map of the area (e.g., Snowdonia National Park, Brecon Beacons National Park) and a reliable compass are essential.\n*   **GPS Device/Phone:** A GPS watch or phone with OS Maps is a great backup. Make sure your phone is fully charged and in a waterproof case. Carry a power bank.\n*   **Headtorch:** Even if you're planning a daytime hike, carry a headtorch with spare batteries. Days are short in winter, and getting caught out in the dark is easy. Expect to pay £20-£50 for a decent headtorch.\n*   **First-Aid Kit:** A basic first-aid kit with blister treatment, pain relief, bandages, and antiseptic wipes. Know how to use it.\n*   **Emergency Shelter:** A lightweight bivy bag or emergency shelter can be a lifesaver if you get stuck in bad weather. Expect to pay £30-£80.\n*   **Whistle:** For signalling for help.\n*   **Emergency Food and Water:** High-energy snacks (chocolate, energy bars, nuts) and plenty of water. A thermos of hot tea or coffee can be a real morale booster.\n\n## Backpack\n\n*   **Size:** 25-40 litres, depending on the length of your hike and the amount of gear you need to carry.\n*   **Features:** Comfortable shoulder straps, a hip belt to distribute weight, and a waterproof cover.\n*   **Price:** Expect to pay £80-£150 for a decent backpack.\n\n## Hire vs. Buy\n\nIf you're only planning a few winter hikes, hiring gear might be a good option. Many outdoor shops in Snowdonia and the Brecon Beacons offer gear hire. Plas y Brenin, the National Mountain Centre, offers courses that include gear, and can advise on what to buy long-term. Expect to pay around £20-£40 per day for a full kit. However, if you plan on hiking regularly, investing in your own gear is worth it.\n\n## Weather Considerations\n\nWelsh weather is notoriously unpredictable. Check the forecast before you go, but be prepared for it to change rapidly. Be aware of the risk of strong winds, snow, and ice. If the weather looks bad, don't be afraid to turn back. There's no shame in admitting defeat.\n\n## Alternatives\n\nIf mountain hiking in winter sounds a bit too intense, consider some lower-level options. A walk along the Pembrokeshire Coast Path can be stunning in winter, although you'll still need to be prepared for the weather. Or try a forest walk in the Brecon Beacons. Coed y Brenin forest park near Dolgellau is great for mountain biking too if hiking isn't your thing.\n\n## Guided Hikes\n\nIf you're new to winter hiking, consider joining a guided hike. Companies like MountainXperience and Snowdonia Mountain Guides offer guided walks up Snowdon and other mountains in Snowdonia. A guided walk on the Llanberis Path with MountainXperience will cost around £45-£65, a summit hike with Snowdonia Mountain Guides is £60-80. They'll provide expert guidance and ensure your safety.\n\nSo, there you have it. A no-nonsense guide to winter hiking gear in Wales. Stay safe, be prepared, and enjoy the stunning scenery – from a safe distance, mind. Now, I'm off for a pint. Sláinte!",
  "heroImage": null,
  "author": "Adventure Wales",
  "regionSlug": null,
  "activityTypeSlug": "hiking",
  "tags": [
    "hiking",
    "mountain",
    "challenging"
  ],
  "readTimeMinutes": 4
}